LineOfCreditNet,Credit facility,1,0001407623-21-000069,1,0,C,,"The carrying value as of the balance sheet date of the current and noncurrent portions of long-term obligations drawn from a line of credit net of unamortized debt discount and deferred financing charges, which is a bank's commitment to make loans up to a specific amount. Examples of items that might be included in the application of this element may consist of letters of credit, standby letters of credit, and revolving credit arrangements, under which borrowings can be made up to a maximum amount as of any point in time conditional on satisfaction of specified terms before, as of and after the date of drawdowns on the line. Includes short-term obligations that would normally be classified as current liabilities but for which (a) postbalance sheet date issuance of a long term obligation to refinance the short term obligation on a long term basis, or (b) the enterprise has entered into a financing agreement that clearly permits the enterprise to refinance the short-term obligation on a long term basis and the following conditions are met (1) the agreement does not expire within 1 year and is not cancelable by the lender except for violation of an objectively determinable provision, (2) no violation exists at the BS date, and (3) the lender has entered into the financing agreement is expected to be financially capable of honoring the agreement.",I,1
LongTermDebtIncludingMembersSubordinatedCertificates,"Long Term Debt, Including Members' Subordinated Certificates",1,0000070502-21-000062,1,0,C,,"Long Term Debt, Including Members' Subordinated Certificates",I,1
DebtExcludingSecuredDebt,"Debt, Excluding Secured Debt",1,0000927628-21-000256,1,0,C,,"Debt, Excluding Secured Debt",I,1
Trustpreferredsecurities,Trust preferred securities,1,0000896159-21-000009,1,0,C,,"Including the current and noncurrent portions, the carrying value of junior subordinated long-term debt owed to unconsolidated subsidiary trusts as of the balance sheet date. Such debt places a lender in a lien position behind debt having a higher priority of repayment in liquidation of the entity's assets and was initially scheduled to be repaid after one year or beyond the normal operating cycle if longer.",I,1
LongTermDebtExcludingLinesOfCreditCurrent,Long Term Debt Excluding Lines Of Credit Current,1,0001564590-21-039521,1,0,C,,Long term debt excluding lines of credit current.,I,1
ShortTermBorrowingsAndNotesPayableToBankCurrent,Short Term Borrowings And Notes Payable To Bank Current,1,0001104659-21-098224,1,0,C,,"Reflects the total carrying amount as of the balance sheet date of short term debt and borrowings and notes payable to bank having initial terms less than one year or the normal operating cycle, if longer.",I,1
LongTermDebtCurrentIncludingDebtIssuanceCosts,Long Term Debt Current Including Debt Issuance Costs,1,0001564590-21-039381,1,0,C,,Long term debt current including debt issuance costs.,I,1
QualifyingDebt,Qualifying Debt,1,0001212545-21-000151,1,0,C,,"Including the current and noncurrent portions, carrying value as of the balance sheet date of junior subordinated debt owed to unconsolidated subsidiary trusts and subordinated debt. Subordinated debt places a lender in a lien position behind debt having a higher priority of repayment in liquidation of the entity's assets.",I,1
DeferredLiabilitiesAndOtherLiabilitiesNoncurrent,"Deferred Liabilities and Other Liabilities, Noncurrent",,0000896622-21-000053,1,0,C,,"Total obligations incurred as part of normal operations that is expected to be repaid beyond the following twelve months or one business cycle, excluding obligations related to long-term debt.",I,1
RecourseDebt,Recourse Debt,1,0000040211-21-000080,1,0,C,,Recourse debt.,I,1
LongTermDebtnetofIssuanceCosts,"Long-Term Debt, net of Issuance Costs",1,0001062231-21-000037,1,0,C,,"Long-Term Debt, net of Issuance Costs based on application of ASU 2015-03.",I,1
ShortTermDebtAndLongTermDebtCurrentMaturities,Short Term Debt And Long Term Debt Current Maturities,1,0001037646-21-000039,1,0,C,,"Total of the portions of the carrying amounts as of the balance sheet date of long-term debt, which may include notes payable notes payable, bonds payable, debentures, mortgage loans, and commercial paper, which are scheduled to be repaid within one year or the normal operating cycle, if longer, and after deducting unamortized discount or premiums, if any. Total may also include short-term borrowings, scheduled to be repaid within one year.",I,1
LongTermDebtOfConsolidatedInvestmentProducts,Long Term Debt Of Consolidated Investment Products,1,0000914208-21-000459,1,0,C,,"Sum of the carrying values as of the balance sheet date of all long-term debt of the entity's consolidated investment products, which is debt initially having maturities due after one year from the balance sheet date or beyond the operating cycle, if longer, but excluding the portions thereof scheduled to be repaid within one year (current maturities) or the normal operating cycle, if longer, and after deducting unamortized discount or premium, if any.",I,1
ChangesInTheFairValueOfDebtInstrumentsMeasuredAtFairValueWithChangesInOtherComprehensiveIncome,Changes in the fair value of debt instruments measured at fair value with changes in other comprehensive income,,0000842180-21-000019,1,0,C,,Changes in the fair value of debt instruments measured at fair value with changes in other comprehensive income,I,1
DebtCertificatesAtFairValue,Debt certificates at fair value,1,0000842180-21-000019,1,0,C,,Debt certificates at fair value,I,1
DebtCertificatesAtAmortizedCost,Debt certificates at amortized cost,1,0000842180-21-000019,1,0,C,,Debt certificates at amortized cost,I,1
SecuredDebtRepurchaseAgreementsAndWarehouseAgreementBorrowings,Secured Debt Repurchase Agreements and Warehouse Agreement Borrowings,1,0001104659-21-097979,1,0,C,,"Carrying value as of the balance sheet date, of securities sold under agreements to repurchase and the carrying value, as of the balance sheet date, of the outstanding borrowings under warehouse and revolving lines of credit.",I,1
LongTermDebtCurrentMaturitiesExcludingCurrentNotesPayable,"Long-Term Debt, Current Maturities, Excluding Current Notes Payable",1,0001634997-21-000069,1,0,C,,"Long-Term Debt, Current Maturities, Excluding Current Notes Payable",I,1
ExternalCurrentDebt,External Current Debt,1,0001637757-21-000011,1,0,C,,External Current Debt,I,1
DebtandDepositLiabilities,Debt and Deposit Liabilities,1,0000083246-21-000017,1,0,C,,Debt and Deposit Liabilities,I,1
LongTermDebtFairValueOptionDisclosure,Long Term Debt Fair Value Option Disclosure,1,0000083246-21-000017,1,0,C,,This element represents the portion of long term debt that the entity has elected to value at fair value under the fair value option.,I,1
LongTermDebtIncludesRedeemablePreferredStockAtRedemptionValue,Long Term Debt Includes Redeemable Preferred Stock At Redemption Value,1,0001410636-21-000189,1,0,C,,Long-term debt includes redeemable preferred stock at redemption value.,I,1
DebtSecuritiesAllowanceforCreditLoss,"Debt Securities, Allowance for Credit Loss",,0000011544-21-000046,1,0,C,,"Debt Securities, Allowance for Credit Loss",I,1
SeniorNotesAndOtherDebt,Senior notes and other debt,1,0000011544-21-000046,1,0,C,,Senior notes and other debt.,I,1
LongTermFinancialDebtNoncurrent,Long Term Financial Debt Noncurrent,1,0001193125-21-233370,1,0,C,,Long term financial debt noncurrent.,I,1
DeferredLeasingAndFinancingCostsAmortization,Deferred Leasing And Financing Costs Amortization,,0000899689-21-000040,1,0,C,,"For an unclassified balance sheet, the accumulated amortization, as of the reporting date, which represents the periodic charge to earnings of initial direct costs which have been deferred and are being allocated over the lease term in proportion to the recognition of rental income, combined with, for an unclassified balance sheet, the accumulated amortization, as of the reporting date, representing the periodic charge to earnings of deferred costs which are associated with debt obligations existing as of the end of the period.",I,1
ShortTermFinancialDebtCurrent,Short Term Financial Debt Current,1,0001193125-21-233370,1,0,C,,Short term financial debt current.,I,1
LiabilitiesOtherThanLongTermDebtRelatedToCapitalizationNoncurrent,"Liabilities, Other Than Long-Term Debt Related To Capitalization, Noncurrent",1,0001056903-21-000095,1,0,C,,"Liabilities, Other Than Long-Term Debt Related To Capitalization, Noncurrent",I,1
LongtermDebtExcludingCurrentMaturitiesAndRelatedParties,"Long-term Debt, Excluding Current Maturities And Related Parties",1,0001628280-21-015250,1,0,C,,"Long-term Debt, Excluding Current Maturities And Related Parties",I,1
CurrentProjectDebt,Current project debt,1,0001140361-21-026550,1,0,C,,The amount of current project debt issued at the project level under project finance.,I,1
NoncurrentPortionOfNoncurrentProjectDebt,Non-current portion of non-current project debt,1,0001140361-21-026550,1,0,C,,The non-current portion of non-current project debt issued at the project level under project finance.,I,1
LongTermDebtAndFinanceLeaseCurrentMaturities,"Long-Term Debt And Finance Lease, Current Maturities",1,0001705682-21-000020,1,0,C,,"Long-Term Debt And Finance Lease, Current Maturities",I,1
LongTermDebtAndFinanceLeaseLiabilityCurrentMaturities,"Long-term Debt and Finance Lease, Liability, Current Maturities",1,0001261654-21-000059,1,0,C,,"Long-term Debt and Finance Lease, Liability, Current Maturities",I,1
LongTermDebtAndFinanceLeaseLiabilityExcludingCurrentMaturities,"Long-term Debt and Finance Lease, Liability, Excluding Current Maturities",1,0001261654-21-000059,1,0,C,,"Long-term Debt and Finance Lease, Liability, Excluding Current Maturities",I,1
AffiliateCurrentDebt,Affiliate Current Debt,1,0001637757-21-000011,1,0,C,,Affiliate Current Debt,I,1
LongTermDebtCurrent1,"Long Term Debt, Current1",1,0001628280-21-015235,1,0,C,,"Amount, after unamortized (discount) premium but before debt issuance costs, of long-term debt, classified as current. Includes, but not limited to, notes payable, bonds payable, debentures, mortgage loans and commercial paper. Excludes capital lease obligations.",I,1
LongTermBorrowings,Long-term Borrowings,1,0000913341-21-000032,1,0,C,,"Amount of long-term borrowings. Includes, but not limited to FHLB borrowings, sub debt from acquiree and finance leases.",I,1
LongTermDebtNonCurrentIncludingAccretion,Long Term Debt Non Current Including Accretion,1,0001628280-21-015330,1,0,C,,Long term debt non current including accretion.,I,1
ConvertibleDebtRelatedPartyNetOfDiscount,"Convertible debt - related party, net of discount of $0.00 and $0.00, respectively",1,0001520138-21-000388,1,0,C,,"Convertible debt - related party, net of discount",I,1
AccruedInterestPayableCurrent,Accrued Interest Payable Current,,0001104659-21-099482,1,0,C,,"Carrying value as of the balance sheet date of accumulated [accrued] interest payable on all forms of debt, including trade payables, that has been incurred and is unpaid. Used to reflect the current portion of the liabilities (due within one year or within the normal operating cycle if longer).",I,1
AccruedInterestPayableNoncurrent,Accrued Interest Payable Noncurrent,1,0001104659-21-099482,1,0,C,,"Carrying value as of the balance sheet date of accumulated[accrued] interest payable on all forms of debt, including trade payables, that has been incurred and is unpaid. Used to reflect the noncurrent portion of the liabilities.",I,1
LongTermDebtExcludingLineOfCreditNoncurrent,Long Term Debt Excluding Line Of Credit Noncurrent,1,0000950170-21-000716,1,0,C,,"Amount after unamortized (discount) premium and debt issuance costs of long-term debt classified as noncurrent and excluding amounts to be repaid within one year or the normal operating cycle, if longer. Includes, but not limited to, notes payable, bonds payable, debentures, mortgage loans and commercial paper. Excludes capital lease obligations and lines of credit",I,1
ShortTermDebtAssumed,Short-Term Debt Assumed,1,0000040545-21-000052,1,0,C,,Short-Term Debt Assumed,I,1
LiabilitiesBeforeDebt,Liabilities Before Debt,,0001060349-21-000062,1,0,C,,"Total of liabilities before senior notes, convertible notes, and subordinated debt.",I,1
LongTermDebtAssumed,Long-Term Debt Assumed,1,0000040545-21-000052,1,0,C,,Long-Term Debt Assumed,I,1
TotalDeferredCreditsAndOtherLiabilities,Total deferred credits and other liabilities,,0001587732-21-000073,1,0,C,,"Total obligations, excluding long-term debt, incurred as part of normal operations that is expected to be repaid beyond the following twelve months or one business cycle.",I,1
NotesPayableAndCurrentMaturitiesOfLongTermDebt,Notes Payable And Current Maturities Of Long Term Debt,1,0000091440-21-000023,1,0,C,,Notes Payable And Current Maturities Of Long Term Debt,I,1
SecuredLongTermDebtSecuritizationProgramCurrent,"Secured Long-Term Debt, Securitization Program, Current",1,0000917520-21-000039,1,0,C,,"Secured Long-Term Debt, Securitization Program, Current",I,1
SecuredLongTermDebtSecuritizationProgramNoncurrent,"Secured Long-Term Debt, Securitization Program, Noncurrent",1,0000917520-21-000039,1,0,C,,"Secured Long-Term Debt, Securitization Program, Noncurrent",I,1
LongTermDebtAndFinanceLeaseObligations,Long-Term Debt And Finance Lease Obligations,1,0001558370-21-009692,1,0,C,,"The amount of long-term debt and finance lease obligations, classified as noncurrent.",I,1
SecuredAndUnsecuredDebtObligations,Secured And Unsecured Debt Obligations,1,0001577670-21-000030,1,0,C,,Secured And Unsecured Debt Obligations,I,1
LongtermDebtGrossAndFinanceLeasesNoncurrent,Longterm Debt Gross And Finance Leases Noncurrent,1,0001558370-21-009692,1,0,C,,"Amount, before unamortized (discount) premium and debt issuance costs, of long-term debt. Includes, but is not limited to, notes payable, bonds payable, commercial loans, mortgage loans, convertible debt, subordinated debt and other types of debt and the present value of lessee's discounted obligation for lease payments from finance lease, classified as noncurrent.",I,1
AccruedInterestPayableAndOtherLiabilities,Accrued Interest Payable and Other Liabilities,,0001127371-21-000128,1,0,C,,"Carrying value as of the balance sheet date of [accrued] interest payable on all forms of debt, including trade payables, that has been incurred and is unpaid. Also, represents the carrying value of the sum of liabilities not individually reported in the financial statements, or separately disclosed in the notes.",I,1
RecourseLongTermDebtNoncurrent,Recourse Long Term Debt Noncurrent,1,0001564590-21-040876,1,0,C,,Recourse long term debt noncurrent.,I,1
LongTermDebtAndFinanceLeaseObligationsNoncurrent,Long Term Debt And Finance Lease Obligations Noncurrent,1,0001628280-21-014825,1,0,C,,Long-term debt and finance lease obligations noncurrent.,I,1
NonRecourseLongTermDebtNoncurrent,Non Recourse Long Term Debt Noncurrent,1,0001564590-21-040876,1,0,C,,Non-recourse long term debt noncurrent.,I,1
VariableInterestEntityCollateralizedLoanObligationSecuritiesLongTermDebt,Variable Interest Entity Collateralized Loan Obligation Securities Long Term Debt,1,0001628280-21-014951,1,0,C,,Represents the carrying amount of collateralized loan obligation securities debt issued by the Variable Interest Entity included in the reporting entity's statement of financial position.,I,1
RecourseLongTermDebtCurrent,Recourse Long Term Debt Current,1,0001564590-21-040876,1,0,C,,Recourse long term debt current.,I,1
ShortTermDebtAndMaturitiesOfLongTermDebtCurrent,"Short-Term Debt And Maturities Of Long-Term Debt, Current",1,0001166003-21-000071,1,0,C,,"Short-Term Debt And Maturities Of Long-Term Debt, Current",I,1
NonRecourseLongTermDebtCurrent,Non Recourse Long Term Debt Current,1,0001564590-21-040876,1,0,C,,Non-recourse long term debt current.,I,1
LongTermDebtandCapitalLeaseObligationsExcludingCurrentPortionNet,"Long-Term Debt and Capital Lease Obligations, Excluding Current Portion, Net",1,0001065696-21-000042,1,0,C,,"Amount of long-term debt and capital lease obligation due after one year or beyond the normal operating cycle, if longer, net of deferred finance costs.",I,1
LongTermObligationsCurrent,"Long-term Obligations, Current",1,0000874015-21-000144,1,0,C,,"Amount of long-term debt, excluding convertible debt, and lease obligations, classified as current, and other current liabilities.",I,1
LiabilitiesOtherThanLongTermDebtAndOperatingLeaseLiabilitiesNoncurrent,"Liabilities, Other than Long-term Debt and Operating Lease Liabilities, Noncurrent",,0000807882-21-000013,1,0,C,,"Liabilities, Other than Long-term Debt and Operating Lease Liabilities, Noncurrent",I,1
LongTermObligationsNoncurrent,"Long-term Obligations, Noncurrent",1,0000874015-21-000144,1,0,C,,"Amount of long-term debt and lease obligation, classified as noncurrent.",I,1
SecuritizedDebtLoansHeldForInvestmentAtFairValue,Securitized Debt Loans Held For Investment At Fair Value,1,0001628280-21-015544,1,0,C,,Secured financing obligations carried at fair value as of the reporting date consisting of securitizations that are collateralized by residential adjustable or fixed rate mortgage loans that have been placed in a trust and pay interest and principal to the debt holders of that securitization.,I,1
LongtermDebtandCapitalLeaseObligationsCurrentNet,"Long-term Debt and Capital Lease Obligations, Current, Net",1,0001065696-21-000042,1,0,C,,"Amount of long-term debt and capital leases due within one year or the normal operating cycle, if longer, net of deferred finance costs.",I,1
SecuritizedDebtNonAgencyResidentialMortgageBackedSecurities,"Securitized Debt, Non-Agency Residential Mortgage-Backed Securities",1,0001628280-21-015544,1,0,C,,Secured financing obligations as of the reporting date consisting of securitizations that are collateralized by Non-Agency residential adjustable or fixed rate mortgage loans that have been placed in a trust and pay interest and principal to the debt holders of the securitization.,I,1
ReceivableBackedNotesPayable,Receivable Backed Notes Payable,1,0000315858-21-000122,1,0,C,,Carrying value as of the balance sheet date of collaterlized debt obligations. Such obligations are recourse and are secured by timeshare consumer notes receivables.,I,1
LongtermDebtandFinanceLeaseObligationCurrent,"Long-term Debt and Finance Lease Obligation, Current",1,0001047340-21-000238,1,0,C,,"Long-term Debt and Finance Lease Obligation, Current",I,1
ReceivableBackedNotesPayableNonRecourse,Receivable Backed Notes Payable Non Recourse,1,0000315858-21-000122,1,0,C,,Carrying value as of the balance sheet date of collaterlized debt obligations. Such obligations are non-recourse and are secured by timeshare consumer notes receivables.,I,1
DebtCurrentExcludingOperatingLeaseLiabilityCurrent,Debt Current Excluding Operating Lease Liability Current,1,0001564590-21-040830,1,0,C,,Debt current excluding operating lease liability current.,I,1
LongTermDebtCurrentAndAccruedInterest,Long Term Debt Current And Accrued Interest,1,0001564590-21-040912,1,0,C,,Long-term debt current and accrued interest.,I,1
LongtermLineofCreditNoncurrentNetofDebtIssuanceCosts,"Long-term Line of Credit, Noncurrent, Net of Debt Issuance Costs",1,0001037976-21-000035,1,0,C,,"Long-term Line of Credit, Noncurrent, Net of Debt Issuance Costs",I,1
LongtermDebtandFinanceLeaseLessCurrentMaturities,"Long-term Debt and Finance Lease, Less Current Maturities",1,0001047340-21-000238,1,0,C,,"Long-term Debt and Finance Lease, Less Current Maturities",I,1
ConvertibleDebtEquity,Convertible Debt Equity,1,0001075531-21-000044,1,0,C,,The equity component of convertible debt that will be settled in cash which has been reclassified to mezzanine (temporary equity) because the debt is redeemable at the reporting date.,I,1
ShorttermDebt,Short term Debt,1,0001037976-21-000035,1,0,C,,"Reflects the total carrying amount as of the balance sheet date of debt having initial terms less than one year of the normal operating cycle, if longer. Excluding Warehouse facilities",I,1
CapitalLeaseLongTermPortion,CapitalLeaseLongTermPortion,1,0001213900-21-040252,1,0,C,,"Amount after unamortized (discount) premium and debt issuance costs of long-term debt classified as noncurrent and excluding amounts to be repaid within one year or the normal operating cycle, if longer. Includes, but not limited to, notes payable, bonds payable, debentures, mortgage loans and commercial paper. Excludes capital lease obligations.",I,1
CapitableLeaseCurrentPortion,CapitableLeaseCurrentPortion,1,0001213900-21-040252,1,0,C,,"Amount of short-term debt and current maturity of long-term debt and capital lease obligations due within one year or the normal operating cycle, if longer.",I,1
DebtAndFinanceLeaseObligationsNet,Debt And Finance Lease Obligations Net,1,0001524358-21-000035,1,0,C,,"Sum of the carrying values as of the balance sheet date of all debt, including all short-term borrowings, long term debt and finance lease obligations, net of unamortized discount and debt issuance costs.",I,1
SecuredDebtAndFinanceLeaseObligations,Secured Debt And Finance Lease Obligations,1,0001075415-21-000019,1,0,C,,"Carrying value as of the balance sheet date, including the current and noncurrent portions, of collateralized debt obligations (with maturities initially due after one year or beyond the operating cycle, if longer). Such obligations include mortgage loans, chattel loans, and any other borrowings secured by assets of the borrower and amount equal to the present value (the principal) at the beginning of the lease term of minimum lease payments during the lease term (excluding that portion of the payments representing executory costs such as insurance, maintenance, and taxes to be paid by the lessor, together with any profit thereon) net of payments or other amounts applied to the principal through the balance sheet date.",I,1
DebtDueToAvisBudgetRentalCarFundingAesopLlcRelatedParty,Debt Due To Avis Budget Rental Car Funding Aesop Llc Related Party,1,0000723612-21-000049,1,0,C,,"Carrying amount as of the balance sheet date of obligations due to Avis Budget Rental Car Funding (AESOP) LLC- a related party, for rental vehicles.",I,1
Debt,Debt,1,0000723612-21-000049,1,0,C,,Carrying value as of the balance sheet date of debt related to rental vehicles due to third party lenders.,I,1
NonRecourseDebtCurrent,Non Recourse Debt Current,1,0000874761-21-000065,1,0,C,,"The current portion of the entity's non-recourse debt. Non-recourse debt is secured by the capital stock, physical assets, contracts and cash flows of the related subsidiary. The risk is limited to the respective subsidiary business and is without recourse to the Parent Company and other subsidiaries.",I,1
RecourseDebtNonCurrent,Recourse Debt Non Current,1,0000874761-21-000065,1,0,C,,The non-current portion of the entity's recourse debt. Recourse debt is direct borrowings by the Parent Company that is structurally subordinate to the affiliates' non-recourse debt.,I,1
DebtAndLeaseLiabilityCurrent,"Debt And Lease Liability, Current",1,0001016281-21-000158,1,0,C,,"Debt And Lease Liability, Current",I,1
LongTermDebtAndCapitalLeaseObligationsLessCurrentMaturities,Long Term Debt And Capital Lease Obligations Less Current Maturities,1,0001564590-21-040789,1,0,C,,Long term debt and capital lease obligations less current maturities.,I,1
NonRecourseDebtNonCurrent,Non Recourse Debt Non Current,1,0000874761-21-000065,1,0,C,,"The non-current portion of the entity's non-recourse debt. Non-recourse debt is secured by the capital stock, physical assets, contracts and cash flows of the related subsidiary. The risk is limited to the respective subsidiary business and is without recourse to the Parent Company and other subsidiaries.",I,1
AcquisitionDebtNetofCurrentPortion,"Acquisition Debt, Net of Current Portion",1,0001016281-21-000158,1,0,C,,"Acquisition Debt, Net of Current Portion",I,1
PreferenceShares,Preference Shares,,0001104659-21-100392,1,0,C,,"The amount of equity instruments that are senior in some aspects to ordinary shares, but subordinate to debt instruments in terms of claim.",I,1
LongTermDebtExcludingSeniorNotesSubordinatedNotesAndJuniorSubordinated,"Long Term Debt Excluding Senior Notes, Subordinated Notes And Junior Subordinated",1,0001558370-21-010596,1,0,C,,"Amount, after unamortized (discount) premium and debt issuance costs, of long-term debt. Includes, but not limited to, notes payable, bonds payable, debentures, mortgage loans and commercial paper. Excludes capital lease obligations, senior Notes, subordinated notes and junior subordinated.",I,1
NonRecourseDebtDue2035Noncurrent,Non Recourse Debt Due 2035 Noncurrent,1,0001558370-21-010555,1,0,C,,The Amount of Non current debt due in 2035 for which creditor does not have general recourse to the debtor but rather has recourse only to the property used for collateral in the transaction or other specific period property.,I,1
LiabilitiesNoncurrentExcludingLongTermDebt,"Liabilities, Noncurrent, Excluding Long-Term Debt",,0001047862-21-000208,1,0,C,,"Liabilities, Noncurrent, Excluding Long-Term Debt",I,1
NonRecourseDebtDue2035Current,Non Recourse Debt Due 2035 Current,1,0001558370-21-010555,1,0,C,,The Amount of current debt due on 2035 for which creditor does not have general recourse to the debtor.,I,1
FilmObligationsNoncurrent,"Film Obligations, Noncurrent",1,0000929351-21-000024,1,0,C,,"The carrying amount of program rights and other film obligations, production loans and production tax credit facility, net of debt issuance costs if applicable. For a classified balance sheet, represents the noncurrent portion only.",I,1
