OtherLongTermDebt,Other Long-term Debt,1,us-gaap/2020,0,0,C,,Amount of long-term debt classified as other.,I,1
DebtInstrumentConvertibleCarryingAmountOfTheEquityComponent,"Debt Instrument, Convertible, Carrying Amount of Equity Component",1,us-gaap/2020,0,0,C,,The carrying amount of the equity component of convertible debt which may be settled in cash upon conversion.,I,1
DebtorInPossessionFinancingBorrowingsOutstanding,"Debtor-in-Possession Financing, Borrowings Outstanding",1,us-gaap/2020,0,0,C,,Amount of debtor-in-possession borrowings outstanding.,I,1
ConvertibleDebt,Convertible Debt,1,us-gaap/2020,0,0,C,,"Including the current and noncurrent portions, carrying amount of debt identified as being convertible into another form of financial instrument (typically the entity's common stock) as of the balance sheet date, which originally required full repayment more than twelve months after issuance or greater than the normal operating cycle of the company.",I,1
MediumtermNotesCurrent,"Medium-term Notes, Current",1,us-gaap/2020,0,0,C,,Carrying value at the balance sheet date of the current portion of a financial instrument used to receive debt funding on a regular basis with original maturities ranging from 5-10 years.,I,1
CurrentDebtInstrumentsIssued,Current debt instruments issued,1,ifrs/2020,0,0,C,,The amount of current debt instruments issued. [Refer: Debt instruments issued],I,1
DebtSecurities,Debt instruments issued,1,ifrs/2020,0,0,C,,The amount of instruments issued by the entity that represent indebtedness.,I,1
NoncurrentDebtInstrumentsIssued,Non-current debt instruments issued,1,ifrs/2020,0,0,C,,The amount of non-current debt instruments issued. [Refer: Debt instruments issued],I,1
AccumulatedAmortizationOfDebtIssuanceCostsLineOfCreditArrangements,"Accumulated Amortization of Debt Issuance Costs, Line of Credit Arrangements",,us-gaap/2021,0,0,C,,Amount of accumulated amortization of debt issuance costs related to line of credit arrangements.,I,1
AccumulatedAmortizationOfCurrentDeferredFinanceCosts,"Accumulated Amortization, Debt Issuance Costs, Current",,us-gaap/2021,0,0,C,,Amount of accumulated amortization of debt issuance costs classified as current.,I,1
BusinessCombinationRecognizedIdentifiableAssetsAcquiredAndLiabilitiesAssumedCurrentLiabilitiesLongTermDebt,"Business Combination, Recognized Identifiable Assets Acquired and Liabilities Assumed, Current Liabilities, Long-term Debt",1,us-gaap/2021,0,0,C,,"Amount of long-term debt due within one year or within the normal operating cycle, if longer, assumed at the acquisition date.",I,1
AociDebtSecuritiesAvailableForSaleWithAllowanceForCreditLossCumulativeGainLossAfterTax,"AOCI, Debt Securities, Available-for-sale with Allowance for Credit Loss, Cumulative Gain (Loss), after Tax",,us-gaap/2021,0,0,C,,"Amount, after tax, of accumulated unrealized gain (loss) on investment in debt security measured at fair value with change in fair value recognized in other comprehensive income (available-for-sale) with allowance for credit loss.",I,1
DebtInstrumentUnamortizedPremium,"Debt Instrument, Unamortized Premium",1,us-gaap/2021,0,0,C,,"Amount, after accumulated amortization, of debt premium.",I,1
DebtSecuritiesAvailableForSaleAmortizedCostAllowanceForCreditLossExcludingAccruedInterest,"Debt Securities, Available-for-Sale, Amortized Cost, Allowance for Credit Loss, Excluding Accrued Interest",,us-gaap/2021,0,0,C,,"Amount excluding accrued interest, of allowance for credit loss on investment in debt security measured at fair value with change in fair value recognized in other comprehensive income (available-for-sale).",I,1
DebtSecuritiesHeldToMaturityAllowanceForCreditLossExcludingAccruedInterest,"Debt Securities, Held-to-Maturity, Allowance for Credit Loss, Excluding Accrued Interest",,us-gaap/2021,0,0,C,,"Amount, excluding accrued interest, of allowance for credit loss on investment in debt security measured at amortized cost (held-to-maturity).",I,1
DebtSecuritiesHeldToMaturityAllowanceForCreditLossNoncurrent,"Debt Securities, Held-to-maturity, Allowance for Credit Loss, Noncurrent",,us-gaap/2021,0,0,C,,"Amount of allowance for credit loss for debt security measured at amortized cost (held-to-maturity), classified as noncurrent.",I,1
FinancialInstrumentsSoldNotYetPurchasedUSGovernmentAndAgencyObligations,"Financial Instruments Sold, Not yet Purchased, US Government and Agency Obligations",1,us-gaap/2021,0,0,C,,Fair value of obligations arising from US treasury and other US government and agency debt obligations sold short.,I,1
FinancialLiabilitiesFairValueDisclosure,Financial Liabilities Fair Value Disclosure,1,us-gaap/2021,0,0,C,,"Fair value of financial obligations, including, but not limited to, debt instruments, derivative liabilities, federal funds purchased and sold under agreements to repurchase, securities loaned or sold under agreements to repurchase, financial instruments sold not yet purchased, guarantees, line of credit, loans and notes payable, servicing liability, and trading liabilities.",I,1
FairValueLiabilitiesMeasuredOnRecurringBasisSubordinatedDebtObligations,"Subordinated Debt Obligations, Fair Value Disclosure",1,us-gaap/2021,0,0,C,,"Fair value of subordinated debt obligations including, but not limited to, subordinated loan, subordinated bond, subordinated debenture or junior debt.",I,1
JuniorSubordinatedNotesCurrent,"Junior Subordinated Notes, Current",1,us-gaap/2021,0,0,C,,"Carrying value as of the balance sheet date of portion of long-term debt due within one year or the operating cycle if longer identified as Junior Subordinated Notes, which have a lower priority than senior instruments.",I,1
LongtermPollutionControlBondCurrentAndNoncurrent,Long-term Pollution Control Bond,1,us-gaap/2021,0,0,C,,"Represents the current and noncurrent portions of a debt security issued by a state, certain agencies or authorities, a local government, or development corporation to finance the construction of air- or water-pollution control facilities or sewage or solid waste disposal facilities pursuant to federal law. The bonds are backed by the credit of the beneficiary of the financing rather than the credit of the issuer.",I,1
LongTermPollutionControlBond,"Long-term Pollution Control Bond, Noncurrent",1,us-gaap/2021,0,0,C,,"Noncurrent portion of a debt security issued by a state, certain agencies or authorities, a local government, or development corporation to finance the construction of air- or water-pollution control facilities or sewage or solid waste disposal facilities pursuant to federal law. The bonds are backed by the credit of the beneficiary of the financing rather than the credit of the issuer.",I,1
PromissoryNoteDebtDiscount,Promissory note debt discount,,0001640334-21-001471,1,0,C,,,I,1
ConvertibleNotesPayableRelatedPartiesCurrent,"Convertible Notes Payable, Related Parties, Current",1,0001140361-21-023160,1,0,C,,Carrying value as of the balance sheet date of the portion of long-term debt due within one year or the operating cycle if longer identified as Convertible Notes Payable due to related parties.,I,1
ConvertiblePromissoryNoteNetOfDebtDiscount,"Convertible promissory note, net of debt discount",1,0001078782-21-000633,1,0,C,,"Represents the monetary amount of Convertible promissory note, net of debt discount, as of the indicated date.",I,1
AccruedInterestPayableRelatedPartiesCurrent,"Accrued Interest Payable, Related Parties, Current",,0001140361-21-023160,1,0,C,,"Carrying value as of the balance sheet date of accrued interest payable, due to related parties on all forms of debt, including trade payables, that has been incurred and is unpaid.",I,1
LineOfCreditRelatedPartiesCurrent,"Line of Credit, Related Parties Current",1,0001140361-21-023160,1,0,C,,"The line of credit, related parties mount as of the balance sheet date of debt having initial terms less than one year or the normal operating cycle, if longer.",I,1
AllowanceForDoubtfulAccountsReceivableAndCashDiscountsCurrent,Allowances for bad debts and cash discounts,,0001437749-21-016577,1,0,C,,"For an unclassified balance sheet, a valuation allowance for receivables due a company that are expected to be uncollectible and for discounts provided for cash payments.",I,1
LongTermDebtAndFinanceLeaseObligationsCurrent,"Long-term Debt And Finance Lease Obligations, Current",1,0001558370-21-008767,1,0,C,,"Amount, after unamortized (discount) premium and debt issuance costs, of long-term debt plus present value of lessee's discounted obligation for lease payments from finance lease, classified as current. Includes, but not limited to, notes payable, bonds payable, debentures, mortgage loans and commercial paper.",I,1
AllOtherLiabilities,All Other Liabilities,1,0001193125-21-211223,1,0,C,,"Amount of all other liabilities, which exclude deposits, other short-term borrowings, and long-term debt.",I,1
LongTermDebtAtFairValueUnderFairValueOption,Long Term Debt At Fair Value Under Fair Value Option,1,0001193125-21-211223,1,0,C,,Aggregate fair value of long-term debt for which the fair value option has been elected.,I,1
DueToTrustAccountAndOtherShortTermDebtAtFairValue,Due To Trust Account And Other Short Term Debt At Fair Value,1,0001193125-21-211223,1,0,C,,Aggregate fair value of due to trust account and other short-term borrowings for which the fair value option has been elected.,I,1
DueToTrustAccountAndShortTermBorrowing,Due To Trust Account And Short Term Borrowing,1,0001193125-21-211223,1,0,C,,"Aggregated amount of due to trust account and short-term borrowings, including (1) the amount of excess cash funds of individual trust accounts which were placed in the trust account, including demand deposits and other overnight funds purchased, and (2) the total carrying amount as of the balance sheet date of debt having initial terms less than one year or the normal operating cycle, if longer.",I,1
PayCheckProtectionProgrammeLongTermDebtNonCurrents,Pay check Protection Programme Long Term Debt Non Currents,1,0001193125-21-213156,1,0,C,,Paycheck protection programme long term debt non-current.,I,1
DebtNonCurrent,Debt Non Current,1,0001193125-21-213210,1,0,C,,Debt non current.,I,1
ShortTermDebtLongTermDebtCurrentMaturitiesAndFinanceLeaseLiabilityCurrent,"Short-Term Debt, Long-Term Debt Current Maturities, And Finance Lease Liability Current",1,0000027904-21-000009,1,0,C,,"Short-Term Debt, Long-Term Debt Current Maturities, And Finance Lease Liability Current",I,1
SharesettledDebtObligationRelatedPartyNetOfDebtDiscountNonCurrent,"Share-settled debt obligation - related party, net of debt discount",1,0001493152-21-016741,1,0,C,,"Share-settled debt obligation - related party, net of debt discount.",I,1
SubordinatedRelatedPartyDebtCurrent,"Current portion of related party subordinated note payable - Starlight Marketing Development, Ltd.",1,0001493152-21-016798,1,0,C,,Current portion of subordinated related party debt.,I,1
SeniorSecuritiesIssued,Senior securities issued,1,0001104659-21-092392,1,0,C,,The amount of senior debt securities issued.,I,1
NotesPayableRelatedParty,"12% Notes payable, related party",1,0001515971-21-000069,1,0,C,,"The portion of the carrying value of related party subordinated debt as of the balance sheet date that is scheduled to be repaid within one year or in the normal operating cycle, if longer. Subordinated debt places a lender in a lien position behind debt having a higher priority of repayment in liquidation of the entity's assets.",I,1
LongTermDebtOtherThanCreditFacilityLessCurrentMaturities,"Long-term Debt other than Credit Facility, Less Current Maturities",1,0001558370-21-009003,1,0,C,,"Amount after unamortized (discount) premium and debt issuance costs of long-term debt other than credit facility classified as noncurrent and excluding amounts to be repaid within one year or the normal operating cycle, if longer.",I,1
LiabilitiesOtherThanLongTermDebtNoncurrentExcludingOperatingLeaseLiabilityNoncurrent,Liabilities Other Than Long Term Debt Noncurrent Excluding Operating Lease Liability Noncurrent,,0001564590-21-037031,1,0,C,,Liabilities other than long term debt noncurrent excluding operating lease liability noncurrent.,I,1
DebtSecuritiesIssuedAtFairValueThroughProfitOrLossDesignatedAsUponInitialRecognition,Debt Securities Issued At Fair Value Through Profit Or Loss Designated As Upon Initial Recognition,1,0001610520-21-000069,1,0,C,,The amount of debt issued designated at fair value.,I,1
OtherDebtNoncurrent,Other Debt Noncurrent,1,0001193125-21-221833,1,0,C,,"Other debt, noncurrent.",I,1
LongTermDebtAndMandatorilyRedeemableSecurities,Long Term Debt and Mandatorily Redeemable Securities,1,0000034782-21-000088,1,0,C,,"This element represents the aggregate carrying amount of long-term borrowings as of the balance sheet date including Federal Home Loan Bank borrowings, current portion of long term debt and promissory notes. Also includes the amount that is required to be paid, determined under the conditions specified in the contract, if as of the reporting date, the shares are mandatorily redeemable after one year from the reporting date or operating cycle, if longer.",I,1
DebtSecuritiesHeldToMaturityAllowanceForCreditLossExcludingMMF,"Debt Securities, Held-to-maturity, Allowance for Credit Loss Excluding MMF",,0000093751-21-000635,1,0,C,,"Debt Securities, Held-to-maturity, Allowance for Credit Loss Excluding MMF",I,1
DebtSecuritiesHeldtomaturityUnderMoneyMarketFacilityAllowanceforCreditLoss,"Debt Securities, Held-to-maturity Under Money Market Facility, Allowance for Credit Loss",,0000093751-21-000635,1,0,C,,"Debt Securities, Held-to-maturity Under Money Market Facility, Allowance for Credit Loss",I,1
DebtFairValueAdjustments,Debt Fair Value Adjustments,,0001506307-21-000079,1,0,C,,"Fair value adjustments to debt as of the balance sheet date including fair value purchase accounting adjustments to debt and fair value of interest rate derivative assets, net of interest rate derivative liabilities, which includes all such derivative instruments in hedging and nonhedging relationships that are recognized on the balance sheet as well as unamortized portions of proceeds received from early termination of interest rate swap agreements.",I,1
LongTermDebtAndCapitalLeaseObligationsAndDeemedLandlordFinancingLiabilitiesNoncurrent,Long Term Debt And Capital Lease Obligations And Deemed Landlord Financing Liabilities Noncurrent,1,0001585583-21-000060,1,0,C,,"Amount of long-term debt, capital lease obligations and deemed landlord financing liabilities due after one year or beyond the normal operating cycle, if longer.",I,1
LongTermDebtAndCapitalLeaseObligationsAndDeemedLandlordFinancingLiabilitiesCurrent,Long Term Debt And Capital Lease Obligations And Deemed Landlord Financing Liabilities Current,1,0001585583-21-000060,1,0,C,,"Amount of long-term debt, capital lease obligations and deemed landlord financing liabilities due within one year or the normal operating cycle, if longer.",I,1
LinesOfCreditShortTermDebtAndCurrentPortionOfLongTermDebt,"Lines of credit, short-term debt and current portion of long-term debt",1,0000866729-21-000013,1,0,C,,"Lines of credit, short term debt and current portion of long term deb",I,1
NotesPayableExcludingConvertibleNotesPayableCurrent,"Current portion of notes payable, net of debt issuance costs of $0, $34,997 and $212,848, respectively",1,0001493152-21-017586,1,0,C,,"Current portion of notes payable, net of debt issuance cost.",I,1
AffiliatedLongTermDebtNoncurrent,Affiliated Long Term Debt Noncurrent,1,0000004904-21-000052,1,0,C,,"Sum of the affiliated carrying values as of the balance sheet date of all long-term debt, which is debt initially having maturities due after one year from the balance sheet date or beyond the operating cycle, if longer, but excluding the portions thereof scheduled to be repaid within one year (current maturities) or the normal operating cycle, if longer, and after deducting unamortized discount or premiums, if any.",I,1
IndebtednessAssociatedWithRealEstateHeldForSaleNet,Indebtedness Associated With Real Estate Held For Sale Net,1,0001564590-21-037946,1,0,C,,"Indebtedness associated with real estate held for sale, net.",I,1
SubordinatedLongTermDebtNetOfDebtIssuanceCosts,Subordinated Long Term Debt Net Of Debt Issuance Costs,1,0000950170-21-000519,1,0,C,,"Carrying value as of the balance sheet date of collateralized/uncollateralized debt obligation (with maturities initially due after one year or beyond the operating cycle if longer), excluding current portion, net of unamortized debt issuance costs. Subordinated debt places a lender in a lien position behind the primary lender of the company.",I,1
LongTermDebtExcludingIndebtednessAssociatedWithRealEstateHeldForSale,Long Term Debt Excluding Indebtedness Associated With Real Estate Held For Sale,1,0001564590-21-037946,1,0,C,,Long term debt excluding indebtedness associated with real estate held for sale.,I,1
SeniorNotesNetOfDebtIssuanceCosts,Senior Notes Net Of Debt Issuance Costs,1,0000950170-21-000519,1,0,C,,"Carrying value as of the balance sheet date of Notes with the highest claim on the assets of the issuer in case of bankruptcy or liquidation (with maturities initially due after one year or beyond the operating cycle if longer), excluding current portion, net of unamortized debt issuance costs. Senior note holders are paid off in full before any payments are made to junior note holders.",I,1
LongtermDebtFinanceLeaseandOtherFinancingObligationsCurrent,"Long-term Debt, Finance Lease and Other Financing Obligations, Current",1,0001477294-21-000132,1,0,C,,"Long-term Debt, Finance Lease and Other Financing Obligations, Current",I,1
AccruedInterestAndTaxes,Accrued Interest And Taxes,,0000753308-21-000148,1,0,C,,"Carrying value as of the balance sheet date of the current portion of obligations incurred and payable (due within one year) for statutory income, sales, use, payroll, excise, real, property and other taxes. AND Sum of the carrying values as of the balance sheet date of interest payable (due within one year) on all forms of debt.",I,1
LongTermDebtAndFinanceLeasesCurrent,Long Term Debt And Finance Leases Current,1,0000950170-21-000524,1,0,C,,Long term debt and finance leases current.,I,1
DebtandCapitalLeaseObligationsnetofdeferredfinancingcosts,"Debt and Capital Lease Obligations, net of deferred financing costs",1,0001660734-21-000087,1,0,C,,"Debt and Capital Lease Obligations, net of deferred financing costs",I,1
RecourseAndNonRecourseDebtAndCapitalLeaseObligations,Recourse And Non-Recourse Debt And Capital Lease Obligations,1,0000099780-21-000113,1,0,C,,Recourse And Non-Recourse Debt And Capital Lease Obligations,I,1
LongTermDebtAndFinanceLeasesNoncurrent,Long Term Debt And Finance Leases Noncurrent,1,0000950170-21-000524,1,0,C,,"Long term debt and finance leases, noncurrent",I,1
LongTermDebtExcludingCurrentMaturitiesAndNotesPayable,"Long-term Debt, Excluding Current Maturities And Notes Payable",1,0000020212-21-000056,1,0,C,,"Long-term Debt, Excluding Current Maturities And Notes Payable",I,1
LongTermDebtNetOfCurrentMaturitiesAndDebtDiscount,"Long Term Debt, net of Current Maturities and Debt Discount",1,0001125376-21-000125,1,0,C,,"Long Term Debt, net of Current Maturities and Debt Discount",I,1
ShortTermBorrowingsAndLongTermDebtCurrent,Short Term Borrowings And Long Term Debt Current,1,0001564590-21-038547,1,0,C,,Short term borrowings and long term debt current.,I,1
LongTermDebtExcludingSeniorNotesHeldBySpecialPurposeEntity,"Long Term Debt, Excluding Senior Notes Held By Special Purpose Entity",1,0001558370-21-009491,1,0,C,,"Amount, after unamortized (discount) premium and debt issuance costs, of long-term debt excluding Senior notes held by special purpose entity.",I,1
AssetSpecificDebtAgreementsNet,Asset specific Debt Agreements Net,1,0001193125-21-226500,1,0,C,,"Asset-specific debt agreements, net.",I,1
SecuritizedDebtObligationsNet,Securitized Debt Obligations Net,1,0001193125-21-226500,1,0,C,,Securitized debt obligations net.,I,1
ProjectDebtNoncurrent,Project Debt Noncurrent,1,0000225648-21-000091,1,0,C,,Project debt noncurrent.,I,1
LongtermDebtRightOfUseFinancingObligationsExcludingCurrentMaturities,"Long-term Debt, Right-Of-Use Financing Obligations, Excluding Current Maturities",1,0001628280-21-014758,1,0,C,,"Long-term Debt, Right-Of-Use Financing Obligations, Excluding Current Maturities",I,1
DebtSecuritiesAtAmortisedCost,Debt securities at amortised cost,1,0001160106-21-000041,1,0,C,,Debt securities at amortised cost,I,1
DebtSeriesBPreferredStock,Debt - Series B Preferred Stock,1,0001652362-21-000151,1,0,C,,Debt - Series B Preferred Stock,I,1
LongTermDebtCurrentNet,Long-Term Debt Current Net,1,0001628280-21-014879,1,0,C,,"Amount, after unamortized (discount) premium and debt issuance costs, of long-term debt, classified as current. Includes, but not limited to, notes payable, bonds payable, debentures, mortgage loans and commercial paper. Excludes capital lease obligations.",I,1
ProjectDebtCurrent,Project Debt Current,1,0000225648-21-000091,1,0,C,,Project debt current.,I,1
LongTermDebtAndFinanceLeaseLiabilitiesNonCurrent,Long Term Debt And Finance Lease Liabilities Non Current,1,0000105634-21-000113,1,0,C,,"Long-term debt and finance lease liabilities, excluding borrowings under revolving credit facility.",I,1
UnsecuredIndebtedness,Unsecured Indebtedness,1,0001564590-21-038832,1,0,C,,Unsecured indebtedness.,I,1
STBorrowingsCurrentPortionofLTDebtAndCurrentPortionOfOtherLTLiabilities,STBorrowingsCurrentPortionofLTDebtAndCurrentPortionOfOtherLTLiabilities,1,0000945841-21-000141,1,0,C,,"Carrying amounts of other borrowings and notes payable which have an initial term of less than one year; the total of the portions of the carrying amounts as of the balance sheet date of long-term debt, which are scheduled to be repaid within one year or the normal operating cycle, if longer, and after deducting unamortized discount or premiums, if any; and the aggregate carrying amount, as of the balance sheet date, of current obligations not separately disclosed in the balance sheet due to materiality considerations.",I,1
LongTermDebtNetOfDeferredFinancingCostsNonCurrent,"Long-Term Debt, Net Of Deferred Financing Costs, Non-Current",1,0001628280-21-014879,1,0,C,,"Amount after unamortized (discount) premium and debt issuance costs of long-term debt classified as noncurrent and excluding amounts to be repaid within one year or the normal operating cycle, if longer. Includes, but not limited to, notes payable, bonds payable, debentures, mortgage loans and commercial paper. Excludes capital lease obligations.",I,1
CurrentMaturitiesOfLongTermDebtAndFinanceLeaseLiabilities,Current Maturities Of Long Term Debt And Finance Lease Liabilities,1,0000105634-21-000113,1,0,C,,Current maturities of long-term debt and finance lease liabilities.,I,1
LongTermDebtCurrentAndShortTermDebt,Long Term Debt Current And Short Term Debt,1,0001558370-21-009581,1,0,C,,The current portion of long term debt and total short term debt.,I,1
DebtorInPossessionFinancingTermLoan,Debtor In Possession Financing Term Loan,1,0001564590-21-038829,1,0,C,,Debtor-in-possession financing term loan.,I,1
LongtermDebtExcludingCurrentMaturitiesNet,"Long-term Debt, Excluding Current Maturities, Net",1,0000802481-21-000077,1,0,C,,"Long-term Debt, Excluding Current Maturities, Net",I,1
LongTermDebtsCurrentExcludingRevolvingCreditFacility,Long Term Debts Current Excluding Revolving Credit Facility,1,0001564590-21-038829,1,0,C,,Long term debt current excluding revolving credit facility.,I,1
CurrentMaturitiesOfNonRecourseLongTermDebt,Current Maturities of Non Recourse Long Term Debt,1,0001357615-21-000124,1,0,C,,"Carrying value as of the balance sheet date of the portion of long-term, collateralized debt obligations due within one year or the operating cycle, if longer, of a consolidated variable interest entity for which creditors (or beneficial interest holders) do not have recourse to the general credit of the primary beneficiary. Such obligations include mortgage loans, chattel loans, and any other borrowings secured by assets of the borrower.",I,1
LongTermDebtNet,Term loan,1,0001407623-21-000069,1,0,C,,"Carrying amount of long-term debt, net of unamortized discount or premium, including current and noncurrent amounts and deferred financing charges. Includes, but not limited to, notes payable, bonds payable, debentures, mortgage loans and commercial paper. Excludes capital lease obligations.",I,1
LongTermDebtCurrentMaturitiesLeaseObligationCurrentAndOtherFinancingCurrent,"Long Term Debt, Current Maturities, Lease Obligation, Current And Other Financing Current",1,0000811156-21-000054,1,0,C,,"Long Term Debt, Current Maturities, Lease Obligation, Current And Other Financing Current",I,1
CurrentPortionOfLongTermDebtAndFinanceLeaseLiabilities,Current Portion Of Long Term Debt And Finance Lease Liabilities,1,0000950170-21-000593,1,0,C,,Current portion of long term debt and finance lease liabilities.,I,1
LiabilitiesAndLeaseObligationsOtherThanLongTermDebtNoncurrent,"Liabilities And Lease Obligations, Other Than Long-term Debt, Noncurrent",,0001172222-21-000075,1,0,C,,"Liabilities And Lease Obligations, Other Than Long-term Debt, Noncurrent",I,1
LongtermDebtCurrentMaturitiesExcludingNotesandBonds,"Long-term Debt, Current Maturities, Excluding Notes and Bonds",1,0000100122-21-000015,1,0,C,,"Long-term Debt, Current Maturities, Excluding Notes and Bonds",I,1
