InvestmentsFixedMaturitiesFairValueOptionVariableInterestEntity,"Investments, Fixed Maturities, Fair Value Option, Variable Interest Entity",,1,0,D,,"Investments, Fixed Maturities, Fair Value Option, Variable Interest Entity",I,1
InvestmentsAccountedForUsingFairValueOption,Investments Accounted For Using Fair Value Option,,1,0,D,,"Certain fixed maturity securities, equity securities and other investments held at fair value under the fair value option afforded by accounting guidance regarding the fair value option for financial assets and liabilities.",I,1
EmployeeStockOptionsLiabilityClassifiedOutstanding,"Employee Stock Options, Liability Classified, Outstanding",,1,0,C,,"Employee Stock Options, Liability Classified, Outstanding",I,1
ClassCSpecialStockValue,Class C Special Stock Value,,1,0,C,,Aggregate par or stated value of issued nonredeemable Class C Special stock (or common stock redeemable solely at the option of the issuer).,I,1
LoansRepurchasedWithGovernmentGuarantees,Loans Repurchased With Government Guarantees,,1,0,D,,The amount of repurchased asset that are the result of exercising the unilateral option to repurchase certain loans in Ginnie Mae pools.,I,1
NoncontrollingInterestsSubjectToRedemption,Noncontrolling Interests Subject to Redemption,,1,0,,,"Noncontrolling interest subject to redemption value that is classified as temporary equity. Temporary equity is a security with redemption features that are outside the control of the issuer, is not classified as an asset or liability in conformity with GAAP, and is not mandatorily redeemable. Includes any type of security that is redeemable at a fixed or determinable price or on a fixed or determinable date or dates, is redeemable at the option of the holder, or has conditions for redemption which are not solely within the control of the issuer.",I,1
ReceivableForStockOptionExercises,Receivable For Stock Option Exercises,,1,0,D,,Receivable For Stock Option Exercises,I,1
DebtSecuritiesAvailableForSaleIncludingFairValueOption,"Debt Securities, Available-For-Sale, Including Fair Value Option",,1,0,D,,"Debt Securities, Available-For-Sale, Including Fair Value Option",I,1
AdjustmenttoopeningretainedearningsnetoftaxpursuanttoadoptionofASU,"Adjustment to opening retained earnings, net of tax, pursuant to adoption of ASU",,1,0,C,,"Adjustment to opening retained earnings, net of tax, pursuant to adoption of ASU",I,1
DerivativesEnergyRelatedLiabilitiesNoncurrent,Derivatives Energy Related Liabilities Noncurrent,,1,0,C,,"Noncurrent liabilities attributable to energy marketing activities (trading activities). Noncurrent energy marketing (trading activities) are when entities engage in both financial and physical trading to increase profits, manage their commodity price risk and enhance system reliability. They may trade electricity, coal, natural gas and oil. These entities typically use a variety of financial instruments, including forward contracts, options and swaps.",I,1
PutOptionLiability,Put Option Liability,,1,0,C,,Put Option Liability,I,1
StockholdersEquityAfterNewAccountingPrincipleInPeriodOfAdoption,Stockholders Equity After New Accounting Principle In Period Of Adoption,,1,0,C,,"Total of all stockholders' equity (deficit) items, net of receivables from officers, directors, owners, and affiliates of the entity which are attributable to the parent, as adjusted for new accounting principle in period of adoption. The amount of the economic entity's stockholders' equity attributable to the parent excludes the amount of stockholders' equity which is allocable to that ownership interest in subsidiary equity which is not attributable to the parent (noncontrolling interest, minority interest). This excludes temporary equity and is sometimes called permanent equity.",I,1
CumulativeEffectOfNewAccountingPrincipleInPeriodOfAdoption1,Cumulative Effect Of New Accounting Principle In Period Of Adoption 1,,1,0,C,,"Amount after tax of increase (decrease) to equity or (increase) decrease to net assets, resulting from the cumulative effect adjustment of a new accounting principle applied in the period of adoption.",I,1
LongTermOptions,Long Term Options,,1,0,C,,Amount recognized for term options classified as noncurrent.,I,1
ConvertibleLongTermNotePayable,ConvertibleLongTermNotePayable,,1,0,C,,"Carrying value as of the balance sheet date of long-term debt (with maturities initially due after one year or beyond the operating cycle if longer) identified as Convertible Notes Payable, excluding current portion. Convertible Notes Payable is a written promise to pay a note which can be exchanged for a specified amount of another, related security, at the option of the issuer and the holder.",I,1
Unearnedrevenuefrompurchaseoptionterminationfees,unearned revenue from purchase option termination fees,,1,0,C,,unearned revenue from purchase option termination fees,I,1
CumulativeEffectOfNewAccountingPrincipleInPeriodsOfAdoption,Cumulative Effect of New Accounting Principle in Periods of Adoption,,1,0,C,,Cumulative Effect of New Accounting Principle in Periods of Adoption,I,1
WrittenOptionsAtFairValue,Written Options At Fair Value,,1,0,C,,Written options at fair value.,I,1
CumulativeEffectOfNewAccountingPronouncementInPeriodOfAdoption,Cumulative Effect of New Accounting Pronouncement in Period of Adoption,,1,0,D,,Cumulative Effect of New Accounting Pronouncement in Period of Adoption,I,1
AccumulatedStockOptionExpense,Stock options (Note 9),,1,0,C,,,I,1
Options,Options,?,1,0,C,,The amount of options.,I,1
GoodwillAndIndefiniteLivedIntangibles,Goodwill And Indefinite Lived Intangibles,,1,0,D,,"Aggregate carrying amount, as of the balance sheet date, of goodwill and other indefinite-lived intangible assets. Goodwill represents the carrying amount as of the balance sheet date, which is the cumulative amount paid, adjusted for any amortization recognized prior to adoption of ASC Topic 350 and for any impairment charges, in excess of the fair value of net assets acquired in one or more business combination transactions. Indefinite-lived intangible assets represent the carrying amount of intangible assets which have a projected indefinite period of benefit (hence are not amortized), allocated to the reportable segment. These assets, acquired either individually or as part of a group of assets, in either an asset acquisition or business combination, are assessed at least annually for impairment. Examples may include trade secrets, contractual rights, trade names, and licensing agreements.",I,1
ConvertibleLoanCurrent,Convertible Loan Current,,1,0,C,,"The portion of the carrying value of long-term convertible debt as of the balance sheet date that is scheduled to be repaid within one year or in the normal operating cycle if longer. Convertible debt is a financial instrument which can be exchanged for a specified amount of another security, typically the entity's common stock, at the option of the issuer or the holder.",I,1
EarlyExercisedStockOptionLiability,EarlyExercisedStockOptionLiability,,1,0,C,,Early exercised stock option liability.,I,1
EarlyOptionExerciseLiability,Early Option Exercise Liability,,1,0,C,,Early option exercise liability.,I,1
CumulativeEffectPeriodOfAdoptionTaxImpact,"Cumulative effect Period of Adoption, tax impact",,1,0,C,,"Cumulative effect Period of Adoption, tax impact",I,1
CumulativeEffectPeriodOfAdoptionAdditionalPaidInCapital,"Cumulative Effect Period of Adoption, Additional Paid In Capital",,1,0,C,,"Cumulative Effect Period of Adoption, Additional Paid In Capital",I,1
CumulativeEffectPeriodOfAdoptionRetainedEarnings,"Cumulative Effect Period of Adoption, Retained Earnings",,1,0,C,,"Cumulative Effect Period of Adoption, Retained Earnings",I,1
DerivativeLiabilityPrivatePlacementOption,"Derivative Liability, Private Placement Option",,1,0,C,,"Derivative Liability, Private Placement Option",I,1
LandOptionLiabliity,"Land Option, Liabliity",,1,0,C,,"Land Option, Liabliity",I,1
OptionToPurchaseAnAdditionalUnitshares,Option To Purchase An Additional Unitshares,,1,0,,,Option to purchase an additional unites.,I,1
AvailableForSaleDebtSecuritiesExcludingSecuritiesValuedAtFairValueOptionAmortizedCost,"Available-for-sale, Debt Securities, Excluding Securities Valued at Fair Value Option, Amortized Cost",,1,0,D,,"Available-for-sale, Debt Securities, Excluding Securities Valued at Fair Value Option, Amortized Cost",I,1
AvailableForSaleDebtSecuritiesExcludingSecuritiesValuedAtFairValueOption,"Available-for-sale, Debt Securities, Excluding Securities Valued at Fair Value Option",,1,0,D,,"Available-for-sale, Debt Securities, Excluding Securities Valued at Fair Value Option",I,1
UnearnedEsopSharesHistoricalCost,Unearned ESOP Shares Historical Cost,,1,0,D,,Historical cost of unearned shares for all classes of common stock and nonredeemable preferred stock (or preferred stock redeemable solely at the option of the issuer) held by an employee stock ownership plan (ESOP). Includes the sale of shares or the issuance treasury shares to an ESOP. These shares are recorded at historical cost and then valued at fair value when released.,I,1
OptionsPurchasedAtCost,Options Purchased At Cost,,1,0,D,,Options purchased at cost.,I,1
Commonstockvalue0,Commonstockvalue0,,1,0,C,,"Aggregate par or stated value of issued nonredeemable common stock (or common stock redeemable solely at the option of the issuer). This item includes treasury stock repurchased by the entity. Note: elements for number of nonredeemable common shares, par value and other disclosure concepts are in another section within stockholders' equity.",I,1
ConvertibleShorttermDebt,ConvertibleShorttermDebt,,1,0,C,,"The portion of the carrying value of short-term convertible debt as of the balance sheet date that is scheduled to be repaid within one year or in the normal operating cycle if longer. Convertible debt is a financial instrument which can be exchanged for a specified amount of another security, typically the entity's common stock, at the option of the issuer or the holder.",I,1
SeriesBPreferredStockParValue,SeriesBPreferredStockParValue,,1,0,C,,"Aggregate par or stated value of issued nonredeemable preferred stock (or preferred stock redeemable solely at the option of the issuer). This item includes treasury stock repurchased by the entity. Note: elements for number of nonredeemable preferred shares, par value and other disclosure concepts are in another section within stockholders' equity.",I,1
ClassACommonStockValue,ClassACommonStockValue,,1,0,C,,"Aggregate par or stated value of issued nonredeemable common stock (or common stock redeemable solely at the option of the issuer). This item includes treasury stock repurchased by the entity. Note: elements for number of nonredeemable common share, par value and other disclosure concepts are in another section within stockholders' equity.",I,1
SeriesAPreferredStockValue,SeriesAPreferredStockValue,,1,0,C,,"Aggregate par or stated value of issued nonredeemable preferred stock (or preferred stock redeemable solely at the option of the issuer). This item includes treasury stock repurchased by the entity. Note: elements for number of nonredeemable preferred shares, par value and other disclosure concepts are in another section within stockholders' equity.",I,1
AdditionalPaidInCapitalOptions,Additional paid in capital - options,,1,0,C,,,I,1
SeriesCPreferredStockValue,SeriesCPreferredStockValue,,1,0,C,,"Aggregate par or stated value of issued nonredeemable preferred stock (or preferred stock redeemable solely at the option of the issuer). This item includes treasury stock repurchased by the entity. Note: elements for number of nonredeemable preferred shares, par value and other disclosure concepts are in another section within stockholders' equity.",I,1
AllowanceForOptionedProperties,Allowance for optioned properties,,1,0,C,,,I,1
NetOpenFutureOptionsContracts,"Net open futures options contracts (net premium paid $0 and $308,675)",,1,0,D,,The amount of net open future options contracts.,I,1
DepositOnOptionToPurchaseBusiness,Deposit on option to purchase business,,1,0,D,,Deposit on option to purchase business.,I,1
NetOpenFutureOptionsContractsPremiumPaid,"Net open future options contracts, premium paid",,1,0,D,,The amount of net open future options contracts premium paid.,I,1
StockholdersEquityCumulativeEffectPeriodOfAdoptionAdjustedBalance,Stockholders Equity Cumulative Effect Period of Adoption Adjusted Balance,,1,0,C,,Stockholders equity cumulative effect period of adoption adjusted balance.,I,1
TemporaryEquitySharesIssued1,TemporaryEquitySharesIssued1,,1,0,,,"The number of securities classified as temporary equity that have been sold (or granted) to the entity's shareholders. Securities issued include securities outstanding and securities held in treasury. Temporary equity is a security with redemption features that are outside the control of the issuer, is not classified as an asset or liability in conformity with GAAP, and is not mandatorily redeemable. Includes any type of security that is redeemable at a fixed or determinable price or on a fixed or determinable date or dates, is redeemable at the option of the holder, or has conditions for redemption which are not solely within the control of the issuer. If convertible, the issuer does not control the actions or events necessary to issue the maximum number of shares that could be required to be delivered under the conversion option if the holder exercises the option to convert the stock to another class of equity.",I,1
TemporaryEquitySharesOutstanding1,TemporaryEquitySharesOutstanding1,?,1,0,,,"The number of securities classified as temporary equity that have been sold (or granted) to the entity's shareholders. Securities issued include securities outstanding and securities held in treasury. Temporary equity is a security with redemption features that are outside the control of the issuer, is not classified as an asset or liability in conformity with GAAP, and is not mandatorily redeemable. Includes any type of security that is redeemable at a fixed or determinable price or on a fixed or determinable date or dates, is redeemable at the option of the holder, or has conditions for redemption which are not solely within the control of the issuer. If convertible, the issuer does not control the actions or events necessary to issue the maximum number of shares that could be required to be delivered under the conversion option if the holder exercises the option to convert the stock to another class of equity.",I,1
StockholdersEquityCumulativeEffectPeriodOfAdoptionAdjustment,StockholdersEquityCumulativeEffectPeriodOfAdoptionAdjustment,,1,0,C,,,I,1
StockholdersEquityCumulativeEffectPeriodOfAdoptionAdjustedBalanceShares,Stockholders Equity Cumulative Effect Period of Adoption Adjusted Balance Shares,,1,0,,,"Stockholders equity cumulative effect period of adoption adjusted balance, shares.",I,1
CommonStock1,CommonStock1,,1,0,C,,"Aggregate par or stated value of issued nonredeemable common stock (or common stock redeemable solely at the option of the issuer). This item includes treasury stock repurchased by the entity. Note: elements for number of nonredeemable common shares, par value and other disclosure concepts are in another section within stockholders' equity.",I,1
CommonStockSubjectToPossibleRedemptionSharesRedemptionValue,CommonStockSubjectToPossibleRedemptionSharesRedemptionValue,?,1,0,,,"Amount to be paid share that is classified as temporary equity by entity upon redemption. Temporary equity is a security with redemption features that are outside the control of the issuer, is not classified as an asset or liability in conformity with GAAP, and is not mandatorily redeemable. Includes any type of security that is redeemable at a fixed or determinable price or on a fixed or determinable date or dates, is redeemable at the option of the holder, or has conditions for redemption which are not solely within the control of the issuer. If convertible, the issuer does not control the actions or events necessary to issue the maximum number of shares that could be required to be delivered under the conversion option if the holder exercises the option to convert the stock to another class of equity. If the security is a warrant or a rights issue, the warrant or rights issue is considered to be temporary equity if the issuer cannot demonstrate that it would be able to deliver upon the exercise of the option by the holder in all cases. Includes stock with put option held by ESOP and stock redeemable by holder only in the event of a change in control of the issuer.",I,1
PreferredStockValue4,PreferredStockValue4,,1,0,C,,"Aggregate par or stated value of issued nonredeemable preferred stock (or preferred stock redeemable solely at the option of the issuer). This item includes treasury stock repurchased by the entity. Note: elements for number of nonredeemable preferred shares, par value and other disclosure concepts are in another section within stockholders' equity.",I,1
CommonStocksValueOne,CommonStocksValueOne,,1,0,C,,"Aggregate par or stated value of issued nonredeemable common stock (or common stock redeemable solely at the option of the issuer). This item includes treasury stock repurchased by the entity. Note: elements for number of nonredeemable common shares, par value and other disclosure concepts are in another section within stockholders' equity.",I,1
ConvertibleNotesPayableNetCurrent,"Convertible Notes Payable, Net, Current",,1,0,C,,"Carrying value as of the balance sheet date of the portion of long-term debt due within one year or the operating cycle if longer identified as Convertible Notes Payable. Convertible Notes Payable is a written promise to pay a note which can be exchanged for a specified amount of another, related security, at the option of the issuer and the holder.",I,1
CommonStockValues,CommonStockValues,,1,0,C,,"Aggregate par or stated values of issued nonredeemable common stock (or common stock redeemable solely at the option of the issuer). This item includes treasury stock repurchased by the entity. Note: elements for number of nonredeemable common shares, par value and other disclosure concepts are in another section within stockholders' equity.",I,1
PreferredStockStatedValuePerShare,"Convertible preferred stock, stated value (in dollars per share)",,1,0,,,Face stated value per share of preferred stock nonredeemable or redeemable solely at the option of the issuer.,I,1
ConvertibleNotesPayableNetOfDiscount,ConvertibleNotesPayableNetOfDiscount,,1,0,C,,"Carrying value as of the balance sheet date of the portion of long-term debt due within one year or the operating cycle if longer identified as Convertible Notes Payable. Convertible Notes Payable net of discount is a written promise to pay a note which can be exchanged for a specified amount of another, related security, at the option of the issuer and the holder.",I,1
TenPercentSecuredConvertibleNotesPayableCurrent,10% Secured convertible notes payable - stockholders,,1,0,C,,"Carrying value as of the balance sheet date of the portion of long-term debt due within one year or the operating cycle if longer identified as 10% Convertible Notes Payable. Convertible Notes Payable is a written promise to pay a note which can be exchanged for a specified amount of another, related security, at the option of the issuer and the holder.",I,1
FourPercentSecuredConvertibleNotesPayableCurrent,4% Secured convertible notes payable - stockholders,,1,0,C,,"Carrying value as of the balance sheet date of the portion of long-term debt due within one year or the operating cycle if longer identified as 4% Convertible Notes Payable. Convertible Notes Payable is a written promise to pay a note which can be exchanged for a specified amount of another, related security, at the option of the issuer and the holder.",I,1
ProvisionForFairValueOfStockOptions,Provision For Fair Value Of Stock Options,,1,0,C,,The carrying value as of the balance sheet date of provision for fair value of stock options.,I,1
PutOptionPayable,Put option payable,,1,0,C,,Put option payable.,I,1
ConvertibleNotePayableCurrent,Convertible Note Payable Current,,1,0,C,,"Carrying value as of the balance sheet date of the portion of long-term debt due within one year or the operating cycle if longer identified as Convertible Notes Payable. Convertible Notes Payable is a written promise to pay a note which can be exchanged for a specified amount of another, related security, at the option of the issuer and the holder.",I,1
SeriesAUepHoldingsLlcSharesOutstanding1,Series A UEP Holdings LLC shares outstanding,,1,0,,,Aggregate share number for all nonredeemable preferred stock (or preferred stock redeemable solely at the option of the issuer) held by stockholders. Does not include preferred shares that have been repurchased.,I,1
PreferredStockEngineeredProductsAcquisitionLimitedSharesIssuedAndOutstanding1,"Preferred stock, Uniroyal Global (Europe) Limited, 50 shares issued and outstanding ($1.51 stated value)",,1,0,C,,"Aggregate par or stated value of issued nonredeemable preferred stock (or preferred stock redeemable solely at the option of the issuer). This item includes treasury stock repurchased by the entity. Note: elements for number of nonredeemable preferred shares, par value and other disclosure concepts are in another section within stockholders' equity.",I,1
PreferredStockSeriesAUepHoldingsLlcUnitsIssuedAndOutstanding,"Preferred units, Series A UEP Holdings, LLC, 200,000 units issued and outstanding ($100 issue price)",,1,0,C,,"Aggregate par or stated value of issued nonredeemable preferred stock (or preferred stock redeemable solely at the option of the issuer). This item includes treasury stock repurchased by the entity. Note: elements for number of nonredeemable preferred shares, par value and other disclosure concepts are in another section within stockholders' equity.",I,1
SeriesAUepHoldingsLlcSharesIssued,Series A UEP Holdings LLC shares issued,,1,0,,,"Total number of nonredeemable preferred shares (or preferred stock redeemable solely at the option of the issuer) issued to shareholders (includes related preferred shares that were issued, repurchased, and remain in the treasury). May be all or portion of the number of preferred shares authorized. Excludes preferred shares that are classified as debt.",I,1
SeriesBUepHoldingsLlcParValue,Series B UEP Holdings LLC par value,,1,0,,,Face amount or stated value per share of preferred stock nonredeemable or redeemable solely at the option of the issuer.,I,1
SeriesBUepHoldingsLlcSharesIssued,Series B UEP Holdings LLC shares issued,,1,0,,,"Total number of nonredeemable preferred shares (or preferred stock redeemable solely at the option of the issuer) issued to shareholders (includes related preferred shares that were issued, repurchased, and remain in the treasury). May be all or portion of the number of preferred shares authorized. Excludes preferred shares that are classified as debt.",I,1
SeriesBUepHoldingsLlcSharesOutstanding,Series B UEP Holdings LLC shares outstanding,,1,0,,,Aggregate share number for all nonredeemable preferred stock (or preferred stock redeemable solely at the option of the issuer) held by stockholders. Does not include preferred shares that have been repurchased.,I,1
PreferredStockSeriesBUepHoldingsLlcUnitsIssuedAndOutstanding,"Preferred units, Series B UEP Holdings, LLC, 150,000 units issued and outstanding ($100 issue price)",,1,0,C,,"Aggregate par or stated value of issued nonredeemable preferred stock (or preferred stock redeemable solely at the option of the issuer). This item includes treasury stock repurchased by the entity. Note: elements for number of nonredeemable preferred shares, par value and other disclosure concepts are in another section within stockholders' equity.",I,1
SeriesAUepHoldingsLlcParValue,Series A UEP Holdings LLC par value,,1,0,,,Face amount or stated value per share of preferred stock nonredeemable or redeemable solely at the option of the issuer.,I,1
PreferredStockLiquidationPreferences,"Preferred stock, liquidation preference",,1,0,D,,The per share liquidation preference (or restrictions) of nonredeemable preferred stock (or preferred stock redeemable solely at the option of the issuer) that has a preference in involuntary liquidation considerably in excess of the par or stated value o,I,1
CumulativeEffectOfNewAccountingPrincipleInPeriodOfAdoptions,Cumulative Effect Of New Accounting Principle In Period Of Adoptions,,1,0,C,,CumulativeEffectOfNewAccountingPrincipleInPeriodOfAdoptions,I,1
PreferredStockSeriesCParValueOf0012000000SharesAuthorizedAsOfDecember3120151107607AndZeroSharesIssuedAndOutstandingAsOfDecember312015AndJune302015Respectively,"Preferred Stock - Series C - Par Value of $.001; 2,000,000 shares designated; No shares issued and outstanding as of June 30, 2020",,1,0,C,,"Aggregate par or stated value of issued nonredeemable preferred stock (or preferred stock redeemable solely at the option of the issuer). This item includes treasury stock repurchased by the entity. Note: elements for number of nonredeemable preferred shares, par value and other disclosure concepts are in another section within stockholders' equity.",I,1
AdditionalPaidInCapitalStockOptions,Additional paid-in capital - stock options,,1,0,C,,Amount of excess of issue price over par or stated value of stock and from other transaction involving stock options.,I,1
