Tag,TLabel,Column Inserted By FY (1 = Include in Cap Table),Custom,Abstract,CRDR,Datatype,Doc,IORD,Count
ShareBasedCompensationArrangementByShareBasedPaymentAwardOptionsVestedAndExpectedToVestOutstandingNumber,"Share-based Compensation Arrangement by Share-based Payment Award, Options, Vested and Expected to Vest, Outstanding, Number",,0,0,,,"Number of fully vested and expected to vest options outstanding that can be converted into shares under option plan. Includes, but is not limited to, unvested options for which requisite service period has not been rendered but that are expected to vest based on achievement of performance condition, if forfeitures are recognized when they occur.",I,1
ShareBasedCompensationArrangementByShareBasedPaymentAwardNumberOfSharesAvailableForGrant,"Share-based Compensation Arrangement by Share-based Payment Award, Number of Shares Available for Grant",,0,0,,,"The difference between the maximum number of shares (or other type of equity) authorized for issuance under the plan (including the effects of amendments and adjustments), and the sum of: 1) the number of shares (or other type of equity) already issued upon exercise of options or other equity-based awards under the plan; and 2) shares (or other type of equity) reserved for issuance on granting of outstanding awards, net of cancellations and forfeitures, if applicable.",I,1
RedeemableNoncontrollingInterestEquityCommonFairValue,"Redeemable Noncontrolling Interest, Equity, Common, Fair Value",,0,0,C,,"The fair value as of the reporting date of noncontrolling interests which are redeemable by the (parent) entity (1) at a fixed or determinable price on a fixed or determinable date, (2) at the option of the holder of the noncontrolling interest, or (3) upon occurrence of an event that is not solely within the control of the (parent) entity. The noncontrolling interest holder's ownership (or holders' ownership) may be in the form of common shares (regardless of class), limited partnership units (regardless of class), non-preferential membership interests, or any other form of common equity regardless of investee entity legal form.",I,1
FinancialInstrumentsOwnedCorporateEquitiesAtFairValue,"Financial Instruments, Owned, Corporate Equities, at Fair Value",,0,0,D,,"The fair value as of the balance sheet date of firm holdings in corporate stocks (common and preferred), stock options, warrants and any other financial instrument which represents, or provides the ability to obtain, ownership rights in a corporation. Includes both pledged (to counterparties as collateral for financing transactions) and unpledged holdings.",I,1
SharesHeldInEmployeeStockOptionPlanCommittedToBeReleased,"Shares Held in Employee Stock Option Plan, Committed-to-be-Released",,0,0,,,Number of committed-to-be-released shares held by the Employee Stock Option Plan at balance sheet date. Committed-to-be-released shares are shares that will be released in the future and will be allocated to employees for services rendered in an accounting period. These shares are legally released from suspense and from serving as collateral for ESOP debt as a result of payment of debt service.,I,1
LandUnderPurchaseOptionsRecorded,"Land under Purchase Options, Recorded",,0,0,D,,The carrying amount as of the balance sheet date of land not owned but under a contract in which the entity has an option to purchase the land.,I,1
FinancialLiabilities,Financial liabilities,,0,0,C,,"The amount of liabilities that are: (a) a contractual obligation: (i) to deliver cash or another financial asset to another entity; or (ii) to exchange financial assets or financial liabilities with another entity under conditions that are potentially unfavourable to the entity; or (b) a contract that will, or may be, settled in the entitys own equity instruments and is: (i) a non-derivative for which the entity is, or may be, obliged to deliver a variable number of the entitys own equity instruments; or (ii) a derivative that will, or may be, settled other than by the exchange of a fixed amount of cash or another financial asset for a fixed number of the entitys own equity instruments. For this purpose, rights, options or warrants to acquire a fixed number of the entitys own equity instruments for a fixed amount of any currency are equity instruments if the entity offers the rights, options or warrants pro rata to all of its existing owners of the same class of its own non-derivative equity instruments. Also, for those purposes the entitys own equity instruments do not include puttable financial instruments that are classified as equity instruments in accordance with paragraphs 16A-16B of IAS 32, instruments that impose on the entity an obligation to deliver to another party a pro rata share of the net assets of the entity only on liquidation and are classified as equity instruments in accordance with paragraphs 16C-16D of IAS 32, or instruments that are contracts for the future receipt or delivery of the entitys own equity instruments. As an exception, an instrument that meets the definition of a financial liability is classified as an equity instrument if it has all the features and meets the conditions in paragraphs 16A-16B or paragraphs 16C-16D of IAS 32. [Refer: Financial instruments, class [member]; Financial assets; Derivatives [member]]",I,1
AcquisitionCostsCumulative,"Acquisition Costs, Cumulative",,0,0,D,,"The capitalized costs incurred (excluded from amortization), as of the date of the balance sheet, to purchase, lease or otherwise acquire an unproved property, including costs of lease bonuses and options to purchase or lease properties, the portion of costs applicable to minerals when land including mineral rights is purchased in fee, brokers' fees, recording fees, legal costs, and other costs incurred in acquiring properties.",I,1
DeferredCompensationSharebasedArrangementsLiabilityCurrentAndNoncurrent,"Deferred Compensation Share-based Arrangements, Liability, Current and Noncurrent",,0,0,C,,Aggregate carrying value as of the balance sheet date of the liabilities for stock option plans and other equity-based compensation arrangements.,I,1
EnergyMarketingContractsAssetsNoncurrent,"Energy Marketing Contracts Assets, Noncurrent",,0,0,D,,"Carrying amount as of the balance sheet date of the asset arising from energy trading activities that involves the purchase and sale of energy under forward contracts at fixed and variable prices and the buying and selling of financial energy contracts that include exchange futures and options and over the counter options and swaps, which are expected to be converted into cash or otherwise disposed of after a year or beyond the normal operating cycle, if longer.",I,1
EnergyMarketingContractLiabilitiesNoncurrent,"Energy Marketing Contract Liabilities, Noncurrent",,0,0,C,,"Fair value of liability arising from energy marketing activities (trading activities), expected to be settled after one year or beyond the normal operating cycle, if longer. Examples of energy marketing activities include, but are not limited to, trading of electricity, coal, natural gas and oil using financial instruments, including, but not limited to, forward contracts, options and swaps.",I,1
OpenOptionContractsWrittenPremiums,"Open Option Contracts Written, Premiums",,0,0,C,,Represents the premiums earned on the open option contracts held by the fund. This item is not required to be disclosed in Regulation S-X but is commonly reported by some funds.,I,1
PreferredStockSharesSubscribedButUnissuedSubscriptionsReceivable,"Preferred Stock, Shares Subscribed but Unissued, Subscriptions Receivable",,0,0,D,,Amount of subscription receivable from investors who have been allocated nonredeemable preferred stock or preferred stock redeemable solely at the option of the issuer.,I,1
PreferredStockSharesSubscribedButUnissuedValue,"Preferred Stock, Value, Subscriptions",,0,0,C,,Amount of subscription received from investors who have been allocated nonredeemable preferred stock or preferred stock redeemable solely at the option of the issuer.,I,1
RedeemableNoncontrollingInterestEquityPreferredFairValue,"Redeemable Noncontrolling Interest, Equity, Preferred, Fair Value",,0,0,C,,"The fair value as of the reporting date of noncontrolling interests which are redeemable by the (parent) entity (1) at a fixed or determinable price on a fixed or determinable date, (2) at the option of the holder of the noncontrolling interest, or (3) upon occurrence of an event that is not solely within the control of the (parent) entity. The noncontrolling interest holder's ownership (or holders' ownership) may be in the form of preferred shares (regardless of class), preferred partnership units (regardless of class), preferential membership interests, or any other form of preferred equity regardless of investee entity legal form.",I,1
ShareBasedCompensationArrangementByShareBasedPaymentAwardOptionsOutstandingIntrinsicValue,"Share-based Compensation Arrangement by Share-based Payment Award, Options, Outstanding, Intrinsic Value",,0,0,D,,Amount by which the current fair value of the underlying stock exceeds the exercise price of options outstanding.,I,1
ShareBasedCompensationArrangementByShareBasedPaymentAwardOptionsExercisableWeightedAverageExercisePrice,"Share-based Compensation Arrangement by Share-based Payment Award, Options, Exercisable, Weighted Average Exercise Price",1,0,0,,,The weighted-average price as of the balance sheet date at which grantees can acquire the shares reserved for issuance on vested portions of options outstanding and currently exercisable under the stock option plan.,I,1
SharebasedCompensationArrangementBySharebasedPaymentAwardOptionsExercisableIntrinsicValue1,"Share-based Compensation Arrangement by Share-based Payment Award, Options, Exercisable, Intrinsic Value",,0,0,D,,Amount of difference between fair value of the underlying shares reserved for issuance and exercise price of vested portions of options outstanding and currently exercisable.,I,1
ShareBasedCompensationArrangementByShareBasedPaymentAwardOptionsOutstandingNumber,"Share-based Compensation Arrangement by Share-based Payment Award, Options, Outstanding, Number",?,0,0,,,"Number of options outstanding, including both vested and non-vested options.",I,1
ShareBasedCompensationArrangementByShareBasedPaymentAwardOptionsExercisableNumber,"Share-based Compensation Arrangement by Share-based Payment Award, Options, Exercisable, Number",1,0,0,,,The number of shares into which fully or partially vested stock options outstanding as of the balance sheet date can be currently converted under the option plan.,I,1
ShareBasedCompensationArrangementByShareBasedPaymentAwardOptionsOutstandingWeightedAverageExercisePrice,"Share-based Compensation Arrangement by Share-based Payment Award, Options, Outstanding, Weighted Average Exercise Price",?,0,0,,,Weighted average price at which grantees can acquire the shares reserved for issuance under the stock option plan.,I,1
LiabilitiesforLandUnderPurchaseOptionsRecorded,"Liabilities for Land Under Purchase Options, Recorded",,1,0,C,,"Liabilities for Land Under Purchase Options, Recorded",I,1
LongTermDebtAtFairValueUnderFairValueOption,Long Term Debt At Fair Value Under Fair Value Option,,1,0,C,,Aggregate fair value of long-term debt for which the fair value option has been elected.,I,1
TradingAccountAssetsAtFairValueUnderFairValueOption,Trading Account Assets At Fair Value Under Fair Value Option,,1,0,D,,Aggregate fair value of trading account assets for which the fair value option has been elected.,I,1
DueToTrustAccountAndOtherShortTermDebtAtFairValue,Due To Trust Account And Other Short Term Debt At Fair Value,,1,0,C,,Aggregate fair value of due to trust account and other short-term borrowings for which the fair value option has been elected.,I,1
IncreaseInOperatingLeaseRightOfUseAssetsAndLeaseLiabilitiesDueToAdoptionOfASC842,Increase In Operating Lease Right-Of-Use Assets And Lease Liabilities Due to Adoption of ASC842,,1,0,D,,Increase In Operating Lease Right-Of-Use Assets And Lease Liabilities Due to Adoption of ASC842,I,1
TradingAccountAssets,Trading Account Assets,,1,0,D,,"Amount of trading account assets. Includes trading account securities, trading derivative assets and liabilities, assets pledged that secured parties are permitted to sell or repledge, and trading assets under fair value option.",I,1
CapitalStockValue,Capital Stock Value,,1,0,C,,Aggregate par or stated value of issued nonredeemable common stock and/or preferred stock. Includes common stock and/or preferred stock redeemable solely at the option of the issuer.,I,1
CumulativeEffectofAccountingChangesinPeriodofAdoption,Cumulative Effect of Accounting Changes in Period of Adoption,,1,0,C,,Cumulative Effect of Accounting Changes in Period of Adoption,I,1
PreferredStockParOrStatedValuePerShare2,"Series F Preferred Stock, par value (in dollars per share)",,1,0,,,Face amount or stated value per share of preferred stock nonredeemable or redeemable solely at the option of the issuer.,I,1
PreferredStockSharesIssued3,"Series G Preferred Stock, issued",,1,0,,,"Total number of nonredeemable preferred shares (or preferred stock redeemable solely at the option of the issuer) issued to shareholders (includes related preferred shares that were issued, repurchased, and remain in the treasury). May be all or portion of the number of preferred shares authorized. Excludes preferred shares that are classified as debt.",I,1
PreferredStockParOrStatedValuePerShare3,"Series G Preferred Stock, par value (in dollars per share)",,1,0,,,Face amount or stated value per share of preferred stock nonredeemable or redeemable solely at the option of the issuer.,I,1
PreferredStockSharesOutstanding3,"Series G Preferred Stock, outstanding",,1,0,,,Aggregate share number for all nonredeemable preferred stock (or preferred stock redeemable solely at the option of the issuer) held by stockholders. Does not include preferred shares that have been repurchased.,I,1
PrepaidPensionCost,PrepaidPensionCost,,1,0,D,,"Cumulative employer's contributions in excess of net pension cost recognized, before the adoption of the recognition provisions of FAS 158. Under FAS 158, prepaid pension costs are no longer recognized in the statement of financial position. Note that there is a separate concept for noncurrent assets relating to defined benefit pension and other defined benefit postretirement plans for use under the recognition provisions of FAS 158.",I,1
PreferredStockSharesAuthorized2,"Series F Preferred Stock, authorized",,1,0,,,The maximum number of nonredeemable preferred shares (or preferred stock redeemable solely at the option of the issuer) permitted to be issued by an entity's charter and bylaws.,I,1
PreferredStockSharesAuthorized3,"Series G Preferred Stock, authorized",,1,0,,,The maximum number of nonredeemable preferred shares (or preferred stock redeemable solely at the option of the issuer) permitted to be issued by an entity's charter and bylaws.,I,1
PreferredStockSharesOutstanding2,"Series F Preferred Stock, outstanding",,1,0,,,Aggregate share number for all nonredeemable preferred stock (or preferred stock redeemable solely at the option of the issuer) held by stockholders. Does not include preferred shares that have been repurchased.,I,1
PreferredStockSharesIssued2,"Series F Preferred Stock, issued",,1,0,,,"Total number of nonredeemable preferred shares (or preferred stock redeemable solely at the option of the issuer) issued to shareholders (includes related preferred shares that were issued, repurchased, and remain in the treasury). May be all or portion of the number of preferred shares authorized. Excludes preferred shares that are classified as debt.",I,1
CumulativeEffectOfNewAccountingPrinciplesInPeriodOfAdoption,Cumulative Effect of New Accounting Principles in Period of Adoption,,1,0,C,,"Amount after tax of changes in equity or changes in net assets, resulting from the cumulative effect adjustment of a new accounting principle applied in the period of adoption.",I,1
EquityAdjustmentForCumulativeEffectOfNewAccountingPrincipleInPeriodOfAdoption,Equity adjustment for Cumulative Effect of New Accounting Principle in Period of Adoption,,1,0,C,,"Amount of stockholders' equity, after the cumulative effect adjustment of a new accounting principle applied in the period of adoption.",I,1
CumulativeEffectOfAdoptionNewAccountingPrinciple,Cumulative effect of adoption new accounting principle,,1,0,D,,Cumulative effect of adoption new accounting principle,I,1
RoyaltiesAndRoyaltyOptions,Royalties and royalty options,,1,0,D,,Royalties and royalty options.,I,1
AdjustmentsDueToAdoptionOfNewAccountingStandards,AdjustmentsDueToAdoptionOfNewAccountingStandards,,1,0,C,,The amount of adjustments to reflect the amendments due to adoption of new accounting standards.,I,1
EquityAdjustedDueToAdoptionOfNewAccountingStandards,EquityAdjustedDueToAdoptionOfNewAccountingStandards,,1,0,C,,The amount of adjusted equity due to adoption of new accounting standards.,I,1
ObligationForConsolidatedInventoryNotOwned,Obligation for consolidated inventory not owned,,1,0,C,,Includes the liabilities related to the remaining exercise price of land and lot option purchases contracts.,I,1
OtherInvestmentsFairValueOption,Other Investments Fair Value Option,,1,0,D,,The balance represents the amount of commercial mortgage loans of consolidated variable interest entities reported as part of other investments for which the fair value option has been elected and an equity method investment for which the fair value option has been elected.,I,1
ConvertiblePreferredStockOptionalRedemption,Convertible Preferred Stock Optional Redemption,,1,0,,,Optional redemption on convertible preferred stock.,I,1
RedeemableLimitedPartners,Redeemable Limited Partners,,1,0,C,,"The greater of carrying value (book value) or fair market value of an entity's issued and outstanding Units which is not included within Partner's Capital in Capital. Represents a security with redemption features that are outside the control of the issuer, is not classified as an asset or liability in conformity with GAAP, and is not mandatorily redeemable. Includes any type of security that is redeemable at a fixed or determinable price or on a fixed or determinable date or dates, is redeemable at the option of the holder, or has conditions for redemption which are not solely within the control of the issuer. If convertible, the issuer does not control the actions or events necessary to issue the maximum number of shares that could be required to be delivered under the conversion option if the holder exercises the option to convert the units to another class of equity.",I,1
CumulativeEffectOfAdoptionOfASU201613,Cumulative Effect of Adoption of ASU 2016-13,,1,0,D,,Cumulative Effect of Adoption of ASU 2016-13,I,1
StockBasedCompensationExpenseFromStockOptionsAndESPPShares,Stock Based Compensation Expense From Stock Options And E S P P Shares,,1,0,,,Stock-based compensation expense from stock options and ESPP shares,I,1
PreferredStockRedeemableandNonRedeemableValue,"Preferred Stock, Redeemable and NonRedeemable, Value",,1,0,C,,"Aggregate par or stated value of issued nonredeemable and redeemable preferred stock (including Series T which may be exercised, at the option of the holder, through tendering the Series T Preferred Stock or paying cash).",I,1
PuttableOptionLiabilitiesNoncurrent,Puttable option liabilities,,1,0,C,,Puttable option liabilities noncurrent.,I,1
PreferredStockConvertibleValue,Preferred Stock Convertible Value,,1,0,C,,"Aggregate par or stated value of issued convertible preferred stock (or preferred stock convertible solely at the option of the holder). Note: elements for number of preferred shares, par value, conversion value and other disclosure concepts are in another section within stockholders' equity.",I,1
PreferredStockNoncumulativeAndNonvoting,Preferred Stock Noncumulative And Nonvoting,,1,0,,,"Percentage of noncumulative, nonvoting preferred stock redeemable solely at the option of the issuer.",I,1
LongTermDebtFairValueOptionDisclosure,Long Term Debt Fair Value Option Disclosure,,1,0,C,,This element represents the portion of long term debt that the entity has elected to value at fair value under the fair value option.,I,1
FairValueOptionLoansHeldasAssets,"Fair Value, Option, Loans Held as Assets",,1,0,D,,"Fair Value, Option, Loans Held as Assets",I,1
AdvancesFromFinancingCompaniesCurrent,"Advances from Financing Companies, Current",,1,0,C,,The current portion of advances from third-party financing companies in which the Company utilizes this financing to provide its customers with a rental option.,I,1
InterestBearingDepositsDomesticFairValueOptionDisclosure,Interest Bearing Deposits Domestic Fair Value Option Disclosure,,1,0,C,,Interest bearing deposits domestic fair value option disclosure.,I,1
AdvancesFromFinancingCompaniesNoncurrent,"Advances from Financing Companies, Noncurrent",,1,0,C,,"Amount of advances from third-party financing companies, net of current portion, in which the Company utilizes this financing to provide its customers with a rental option.",I,1
SpecialStockSharesOutstanding,Special Stock Shares Outstanding,,1,0,,,Aggregate share number for all special stock redeemable solely at the option of the issuer held by the Manager.,I,1
CumulativeEffectofAdoptionofASUNo201613NetofTaxes,"Cumulative Effect of Adoption of ASU No 2016-13, Net of Taxes",,1,0,C,,"Cumulative Effect of Adoption of ASU No 2016-13, Net of Taxes",I,1
SpecialStockSharesIssued,Special Stock Shares Issued,,1,0,,,Total number of special stock redeemable solely at the option of the issuer issued to the Manager.,I,1
LiabilitiesAttributableToConsolidatedOptionAgreements,Liabilities Attributable To Consolidated Option Agreements,,1,0,C,,Liabilities Attributable To Consolidated Option Agreements,I,1
FinancingReceivableAndWrittenLoanCommitmentsFairValueOption,"Financing Receivable And Written Loan Commitments, Fair Value Option",,1,0,C,,"Financing Receivable and Written Loan Commitments, Fair Value Option",I,1
AvailableforsaleSecuritiesFairValueOption,"Securities available for sale, fair value option",,1,0,D,,Represents the fair value option for available-for-sale securities.,I,1
FairValueOptionSecurities,Fair value option securities,,1,0,D,,"Fair value option securities represent securities the Company has elected to carry at fair value and separately identified on the balance sheet with changes in fair value recognized in earnings as they occur. Certain residential mortgage-backed securities issued by US government agencies are held as an economic hedge of changes in the fair value of mortgage servicing rights and related derivative contracts. In addition, other securities may be held to manage interest rate risk or for deferred compensation purposes. Securities held for interest rate risk management may be economically hedged by derivative contracts not designated as hedging instruments effectively modify these fixed rate securities into variable rate securities.",I,1
KinrossCallOption,Kinross call option,,1,0,C,,,I,1
AvailableForSaleSecuritiesFairValueDisclosureHeldInTrust,Available For Sale Securities Fair Value Disclosure Held In Trust,,1,0,D,,"This element represents the portion of the balance sheet assertion valued at fair value by the entity, which is held in a mortgage-backed security, whether such amount is presented as a separate caption or as a parenthetical disclosure. Additionally, this element may by used in connection with the fair value disclosures required in the footnote disclosures to the financial statements. The element may be used in both the balance sheet and disclosure in the same submission. This item represents Available-for-sale Securities which consist of all investments in certain debt and equity securities neither classified as trading or held-to-maturity securities. A debt security represents a creditor relationship with an enterprise. Debt securities include, among other items, US Treasury securities, US government securities, municipal securities, corporate bonds, convertible debt, commercial paper, and all securitized debt instruments. An equity security represents an ownership interest in an enterprise or the right to acquire or dispose of an ownership interest in an enterprise at fixed or determinable prices. Equity securities include, among other things, common stock, certain preferred stock, warrant rights, call options, and put options, but do not include convertible debt. An entity may opt to provide the reader with additional narrative text to better understand the nature of investments in debt and equity securities which are categorized as Available-for-sale.",I,1
FairValueOptionLoansHeldasAssetsAggregateFairValue,"Fair Value, Option, Loans Held as Assets, Aggregate Fair Value",,1,0,D,,"Fair Value, Option, Loans Held as Assets, Aggregate Fair Value",I,1
LEOCallOptionLiabilityCurrent,L E O Call Option Liability Current,,1,0,C,,LEO call option liability current.,I,1
NotesIssuedByConsolidatedVariableInterestEntityFairValueOption,"Notes Issued By Consolidated Variable Interest Entity, Fair Value Option",,1,0,C,,"Notes Issued By Consolidated Variable Interest Entity, Fair Value Option",I,1
PreferredStockValueExcludingTreasuryStock,Preferred Stock Value Excluding Treasury Stock,,1,0,C,,"Aggregate par or stated value of issued nonredeemable preferred stock (or preferred stock redeemable solely at the option of the issuer). Note: elements for number of nonredeemable preferred shares, par value and other disclosure concepts are in another section within stockholders' equity.",I,1
